{
  "capability_schema_version": 1,
  "renderer": {"id": "python-svg-prototype", "name": "Python shared-scene SVG renderer", "version": "1"},
  "scene_schema_versions": [1],
  "output_formats": ["svg"],
  "matrix_kinds": ["correlation_plot", "general_matrix_plot"],
  "cell_methods": ["circle", "square", "ellipse", "number", "shade", "color", "pie"],
  "features": {
    "row_labels": true, "column_labels": true, "plotmath_labels": false,
    "missing_cells": true, "cell_text_annotations": true, "significance": true,
    "confidence_intervals": true, "legend": false, "figure_text": true,
    "accessible_metadata": true
  },
  "negotiation_modes": ["strict", "permissive"]
}
